{"irId":"ir-matrix-mc-x02","concept":{"name":"MING·明式铜炉书房·暗香浮动","ontologyPath":"/aesthetics/chinese-aesthetic"},"intent":{"statement":"BRONZE + DIM","heuristicIds":["lighting-intent:DIM","paradigm:MING","material-category:BRONZE"]},"parameters":[{"paramId":"focal-point","path":"/composition/focalPoint","value":[0.48,0.38],"confidence":0.95,"source":{"type":"derived","ref":"MC-X02"},"calibration":{"method":"uncalibrated","status":"EXPERIMENTAL"}},{"paramId":"negative-space-ratio","path":"/composition/negativeSpaceRatio","value":0.3,"confidence":0.95,"source":{"type":"derived","ref":"MC-X02"},"calibration":{"method":"uncalibrated","status":"EXPERIMENTAL"}},{"paramId":"depth-layer-count","path":"/composition/depthLayerCount","value":4,"confidence":0.95,"source":{"type":"derived","ref":"MC-X02"},"calibration":{"method":"uncalibrated","status":"EXPERIMENTAL"}},{"paramId":"symmetry","path":"/composition/symmetry","value":0.76,"confidence":0.95,"source":{"type":"derived","ref":"MC-X02"},"calibration":{"method":"uncalibrated","status":"EXPERIMENTAL"}},{"paramId":"fov","path":"/camera/fov","value":50,"confidence":0.95,"source":{"type":"derived","ref":"MC-X02"},"calibration":{"method":"uncalibrated","status":"EXPERIMENTAL"}},{"paramId":"shot-size","path":"/camera/shotSize","value":"medium-shot","confidence":0.95,"source":{"type":"derived","ref":"MC-X02"},"calibration":{"method":"uncalibrated","status":"EXPERIMENTAL"}},{"paramId":"camera-angle","path":"/camera/angle","value":10,"confidence":0.95,"source":{"type":"derived","ref":"MC-X02"},"calibration":{"method":"uncalibrated","status":"EXPERIMENTAL"}},{"paramId":"camera-height","path":"/camera/height","value":1.3,"confidence":0.95,"source":{"type":"derived","ref":"MC-X02"},"calibration":{"method":"uncalibrated","status":"EXPERIMENTAL"}},{"paramId":"keylight-azimuth","path":"/lighting/keyLight/azimuth","value":10,"confidence":0.95,"source":{"type":"derived","ref":"MC-X02"},"calibration":{"method":"uncalibrated","status":"EXPERIMENTAL"}},{"paramId":"keylight-elevation","path":"/lighting/keyLight/elevation","value":25,"confidence":0.95,"source":{"type":"derived","ref":"MC-X02"},"calibration":{"method":"uncalibrated","status":"EXPERIMENTAL"}},{"paramId":"keylight-color-temp","path":"/lighting/keyLight/colorTemp","value":4200,"confidence":0.95,"source":{"type":"derived","ref":"MC-X02"},"calibration":{"method":"uncalibrated","status":"EXPERIMENTAL"}},{"paramId":"keylight-intensity","path":"/lighting/keyLight/intensity","value":0.55,"confidence":0.95,"source":{"type":"derived","ref":"MC-X02"},"calibration":{"method":"uncalibrated","status":"EXPERIMENTAL"}},{"paramId":"keylight-softness","path":"/lighting/keyLight/softness","value":0.5,"confidence":0.95,"source":{"type":"derived","ref":"MC-X02"},"calibration":{"method":"uncalibrated","status":"EXPERIMENTAL"}},{"paramId":"ambient-ratio","path":"/lighting/ambientRatio","value":0.2,"confidence":0.95,"source":{"type":"derived","ref":"MC-X02"},"calibration":{"method":"uncalibrated","status":"EXPERIMENTAL"}},{"paramId":"rim-light-present","path":"/lighting/rimLightPresent","value":true,"confidence":0.95,"source":{"type":"derived","ref":"MC-X02"},"calibration":{"method":"uncalibrated","status":"EXPERIMENTAL"}},{"paramId":"dominant-material-type","path":"/materials/0/baseType","value":"BRONZE::ming-censer-bronze","confidence":0.95,"source":{"type":"derived","ref":"MC-X02"},"calibration":{"method":"uncalibrated","status":"EXPERIMENTAL"}},{"paramId":"dominant-material-roughness","path":"/materials/0/roughness","value":0.45,"confidence":0.95,"source":{"type":"derived","ref":"MC-X02"},"calibration":{"method":"uncalibrated","status":"EXPERIMENTAL"}},{"paramId":"dominant-material-metalness","path":"/materials/0/metalness","value":0.82,"confidence":0.95,"source":{"type":"derived","ref":"MC-X02"},"calibration":{"method":"uncalibrated","status":"EXPERIMENTAL"}},{"paramId":"dominant-material-wear","path":"/materials/0/wear","value":0.3,"confidence":0.95,"source":{"type":"derived","ref":"MC-X02"},"calibration":{"method":"uncalibrated","status":"EXPERIMENTAL"}},{"paramId":"dominant-color","path":"/color/dominant","value":"#4B5054","confidence":0.95,"source":{"type":"derived","ref":"MC-X02"},"calibration":{"method":"uncalibrated","status":"EXPERIMENTAL"}},{"paramId":"secondary-color","path":"/color/secondary","value":"#8A7358","confidence":0.95,"source":{"type":"derived","ref":"MC-X02"},"calibration":{"method":"uncalibrated","status":"EXPERIMENTAL"}},{"paramId":"accent-color","path":"/color/accent","value":"#6C4638","confidence":0.95,"source":{"type":"derived","ref":"MC-X02"},"calibration":{"method":"uncalibrated","status":"EXPERIMENTAL"}},{"paramId":"contrast-ratio","path":"/color/contrastRatio","value":1.5,"confidence":0.95,"source":{"type":"derived","ref":"MC-X02"},"calibration":{"method":"uncalibrated","status":"EXPERIMENTAL"}},{"paramId":"temperature-bias","path":"/color/temperatureBias","value":-0.04,"confidence":0.95,"source":{"type":"derived","ref":"MC-X02"},"calibration":{"method":"uncalibrated","status":"EXPERIMENTAL"}}],"provenance":{"corpusSources":[{"corpusId":"golden-case-matrix-v1.0.1","title":"Golden Case Matrix Contract v1.0.1","type":"article"}],"distillationMethod":"synthetic representative-cell authoring"},"distillerVersion":"1.0.1","grammarVersion":"chinese-aesthetic@1.1.0","metadata":{"tags":["paradigm:MING","material-category:BRONZE","lighting-intent:DIM","matrix-cell:MC-X02","synthetic-ir"]}}
