{"irId":"ir-matrix-mc-m01","concept":{"name":"MING·明式黄花梨厅堂·北窗日光","ontologyPath":"/aesthetics/chinese-aesthetic"},"intent":{"statement":"WOOD + DAYLIGHT","heuristicIds":["lighting-intent:DAYLIGHT","paradigm:MING","material-category:WOOD"]},"parameters":[{"paramId":"focal-point","path":"/composition/focalPoint","value":[0.5,0.42],"confidence":0.95,"source":{"type":"expert-judgment","ref":"matrix-v1.0.1"},"calibration":{"method":"uncalibrated","status":"EXPERIMENTAL"}},{"paramId":"negative-space-ratio","path":"/composition/negativeSpaceRatio","value":0.32,"confidence":0.95,"source":{"type":"expert-judgment","ref":"matrix-v1.0.1"},"calibration":{"method":"uncalibrated","status":"EXPERIMENTAL"}},{"paramId":"depth-layer-count","path":"/composition/depthLayerCount","value":5,"confidence":0.95,"source":{"type":"expert-judgment","ref":"matrix-v1.0.1"},"calibration":{"method":"uncalibrated","status":"EXPERIMENTAL"}},{"paramId":"symmetry","path":"/composition/symmetry","value":0.78,"confidence":0.95,"source":{"type":"expert-judgment","ref":"matrix-v1.0.1"},"calibration":{"method":"uncalibrated","status":"EXPERIMENTAL"}},{"paramId":"fov","path":"/camera/fov","value":45,"confidence":0.95,"source":{"type":"expert-judgment","ref":"matrix-v1.0.1"},"calibration":{"method":"uncalibrated","status":"EXPERIMENTAL"}},{"paramId":"shot-size","path":"/camera/shotSize","value":"wide-shot","confidence":0.95,"source":{"type":"expert-judgment","ref":"matrix-v1.0.1"},"calibration":{"method":"uncalibrated","status":"EXPERIMENTAL"}},{"paramId":"camera-angle","path":"/camera/angle","value":0,"confidence":0.95,"source":{"type":"expert-judgment","ref":"matrix-v1.0.1"},"calibration":{"method":"uncalibrated","status":"EXPERIMENTAL"}},{"paramId":"camera-height","path":"/camera/height","value":1.5,"confidence":0.95,"source":{"type":"expert-judgment","ref":"matrix-v1.0.1"},"calibration":{"method":"uncalibrated","status":"EXPERIMENTAL"}},{"paramId":"keylight-azimuth","path":"/lighting/keyLight/azimuth","value":-10,"confidence":0.95,"source":{"type":"expert-judgment","ref":"matrix-v1.0.1"},"calibration":{"method":"uncalibrated","status":"EXPERIMENTAL"}},{"paramId":"keylight-elevation","path":"/lighting/keyLight/elevation","value":32,"confidence":0.95,"source":{"type":"expert-judgment","ref":"matrix-v1.0.1"},"calibration":{"method":"uncalibrated","status":"EXPERIMENTAL"}},{"paramId":"keylight-color-temp","path":"/lighting/keyLight/colorTemp","value":5600,"confidence":0.95,"source":{"type":"expert-judgment","ref":"matrix-v1.0.1"},"calibration":{"method":"uncalibrated","status":"EXPERIMENTAL"}},{"paramId":"keylight-intensity","path":"/lighting/keyLight/intensity","value":1.1,"confidence":0.95,"source":{"type":"expert-judgment","ref":"matrix-v1.0.1"},"calibration":{"method":"uncalibrated","status":"EXPERIMENTAL"}},{"paramId":"keylight-softness","path":"/lighting/keyLight/softness","value":0.65,"confidence":0.95,"source":{"type":"expert-judgment","ref":"matrix-v1.0.1"},"calibration":{"method":"uncalibrated","status":"EXPERIMENTAL"}},{"paramId":"ambient-ratio","path":"/lighting/ambientRatio","value":0.35,"confidence":0.95,"source":{"type":"expert-judgment","ref":"matrix-v1.0.1"},"calibration":{"method":"uncalibrated","status":"EXPERIMENTAL"}},{"paramId":"rim-light-present","path":"/lighting/rimLightPresent","value":false,"confidence":0.95,"source":{"type":"expert-judgment","ref":"matrix-v1.0.1"},"calibration":{"method":"uncalibrated","status":"EXPERIMENTAL"}},{"paramId":"dominant-material-type","path":"/materials/0/baseType","value":"WOOD::ming-huanghuali","confidence":0.95,"source":{"type":"expert-judgment","ref":"matrix-v1.0.1"},"calibration":{"method":"uncalibrated","status":"EXPERIMENTAL"}},{"paramId":"dominant-material-roughness","path":"/materials/0/roughness","value":0.65,"confidence":0.95,"source":{"type":"expert-judgment","ref":"matrix-v1.0.1"},"calibration":{"method":"uncalibrated","status":"EXPERIMENTAL"}},{"paramId":"dominant-material-metalness","path":"/materials/0/metalness","value":0.03,"confidence":0.95,"source":{"type":"expert-judgment","ref":"matrix-v1.0.1"},"calibration":{"method":"uncalibrated","status":"EXPERIMENTAL"}},{"paramId":"dominant-material-wear","path":"/materials/0/wear","value":0.35,"confidence":0.95,"source":{"type":"expert-judgment","ref":"matrix-v1.0.1"},"calibration":{"method":"uncalibrated","status":"EXPERIMENTAL"}},{"paramId":"dominant-color","path":"/color/dominant","value":"#7A6A55","confidence":0.95,"source":{"type":"expert-judgment","ref":"matrix-v1.0.1"},"calibration":{"method":"uncalibrated","status":"EXPERIMENTAL"}},{"paramId":"secondary-color","path":"/color/secondary","value":"#D8D0C0","confidence":0.95,"source":{"type":"expert-judgment","ref":"matrix-v1.0.1"},"calibration":{"method":"uncalibrated","status":"EXPERIMENTAL"}},{"paramId":"accent-color","path":"/color/accent","value":"#3F5966","confidence":0.95,"source":{"type":"expert-judgment","ref":"matrix-v1.0.1"},"calibration":{"method":"uncalibrated","status":"EXPERIMENTAL"}},{"paramId":"contrast-ratio","path":"/color/contrastRatio","value":1.7,"confidence":0.95,"source":{"type":"expert-judgment","ref":"matrix-v1.0.1"},"calibration":{"method":"uncalibrated","status":"EXPERIMENTAL"}},{"paramId":"temperature-bias","path":"/color/temperatureBias","value":-0.02,"confidence":0.95,"source":{"type":"expert-judgment","ref":"matrix-v1.0.1"},"calibration":{"method":"uncalibrated","status":"EXPERIMENTAL"}}],"provenance":{"corpusSources":[{"corpusId":"golden-case-matrix-v1.0.1","title":"Golden Case Matrix Contract v1.0.1","type":"article"}],"distillationMethod":"synthetic representative-cell authoring"},"distillerVersion":"1.0.1","grammarVersion":"chinese-aesthetic@1.1.0","metadata":{"tags":["paradigm:MING","material-category:WOOD","lighting-intent:DAYLIGHT","matrix-cell:MC-M01","synthetic-ir"]}}
