{"irId":"ir-matrix-mc-t01","concept":{"name":"TANG·唐式鎏金铜殿·日光普照","ontologyPath":"/aesthetics/chinese-aesthetic"},"intent":{"statement":"BRONZE + DAYLIGHT","heuristicIds":["lighting-intent:DAYLIGHT","paradigm:TANG","material-category:BRONZE"]},"parameters":[{"paramId":"focal-point","path":"/composition/focalPoint","value":[0.5,0.35],"confidence":0.95,"source":{"type":"expert-judgment","ref":"golden-case-matrix-v1.0.1"},"calibration":{"method":"uncalibrated","status":"EXPERIMENTAL"}},{"paramId":"negative-space-ratio","path":"/composition/negativeSpaceRatio","value":0.15,"confidence":0.95,"source":{"type":"expert-judgment","ref":"golden-case-matrix-v1.0.1"},"calibration":{"method":"uncalibrated","status":"EXPERIMENTAL"}},{"paramId":"symmetry","path":"/composition/symmetry","value":0.82,"confidence":0.95,"source":{"type":"expert-judgment","ref":"golden-case-matrix-v1.0.1"},"calibration":{"method":"uncalibrated","status":"EXPERIMENTAL"}}],"provenance":{"corpusSources":[{"corpusId":"golden-case-matrix-v1.0.1","title":"Golden Case Matrix Contract v1.0.1","type":"article"}],"distillationMethod":"synthetic representative-cell authoring"},"distillerVersion":"1.0.1","grammarVersion":"chinese-aesthetic@1.1.0","metadata":{"tags":["paradigm:TANG","material-category:BRONZE","lighting-intent:DAYLIGHT","matrix-cell:MC-T01","synthetic-ir"]}}
