{"irId":"ir-matrix-mc-s01","concept":{"name":"SONG·宋式石山水榭·月光朦胧","ontologyPath":"/aesthetics/chinese-aesthetic"},"intent":{"statement":"STONE + DIM","heuristicIds":["lighting-intent:DIM","paradigm:SONG","material-category:STONE"]},"parameters":[{"paramId":"focal-point","path":"/composition/focalPoint","value":[0.62,0.4],"confidence":0.95,"source":{"type":"expert-judgment","ref":"matrix-v1.0.1"},"calibration":{"method":"uncalibrated","status":"EXPERIMENTAL"}},{"paramId":"negative-space-ratio","path":"/composition/negativeSpaceRatio","value":0.68,"confidence":0.95,"source":{"type":"expert-judgment","ref":"matrix-v1.0.1"},"calibration":{"method":"uncalibrated","status":"EXPERIMENTAL"}},{"paramId":"depth-layer-count","path":"/composition/depthLayerCount","value":4,"confidence":0.95,"source":{"type":"expert-judgment","ref":"matrix-v1.0.1"},"calibration":{"method":"uncalibrated","status":"EXPERIMENTAL"}},{"paramId":"symmetry","path":"/composition/symmetry","value":0.18,"confidence":0.95,"source":{"type":"expert-judgment","ref":"matrix-v1.0.1"},"calibration":{"method":"uncalibrated","status":"EXPERIMENTAL"}},{"paramId":"fov","path":"/camera/fov","value":55,"confidence":0.95,"source":{"type":"expert-judgment","ref":"matrix-v1.0.1"},"calibration":{"method":"uncalibrated","status":"EXPERIMENTAL"}},{"paramId":"shot-size","path":"/camera/shotSize","value":"wide-shot","confidence":0.95,"source":{"type":"expert-judgment","ref":"matrix-v1.0.1"},"calibration":{"method":"uncalibrated","status":"EXPERIMENTAL"}},{"paramId":"camera-angle","path":"/camera/angle","value":35,"confidence":0.95,"source":{"type":"expert-judgment","ref":"matrix-v1.0.1"},"calibration":{"method":"uncalibrated","status":"EXPERIMENTAL"}},{"paramId":"camera-height","path":"/camera/height","value":1.2,"confidence":0.95,"source":{"type":"expert-judgment","ref":"matrix-v1.0.1"},"calibration":{"method":"uncalibrated","status":"EXPERIMENTAL"}},{"paramId":"keylight-azimuth","path":"/lighting/keyLight/azimuth","value":35,"confidence":0.95,"source":{"type":"expert-judgment","ref":"matrix-v1.0.1"},"calibration":{"method":"uncalibrated","status":"EXPERIMENTAL"}},{"paramId":"keylight-elevation","path":"/lighting/keyLight/elevation","value":22,"confidence":0.95,"source":{"type":"expert-judgment","ref":"matrix-v1.0.1"},"calibration":{"method":"uncalibrated","status":"EXPERIMENTAL"}},{"paramId":"keylight-color-temp","path":"/lighting/keyLight/colorTemp","value":4000,"confidence":0.95,"source":{"type":"expert-judgment","ref":"matrix-v1.0.1"},"calibration":{"method":"uncalibrated","status":"EXPERIMENTAL"}},{"paramId":"keylight-intensity","path":"/lighting/keyLight/intensity","value":0.5,"confidence":0.95,"source":{"type":"expert-judgment","ref":"matrix-v1.0.1"},"calibration":{"method":"uncalibrated","status":"EXPERIMENTAL"}},{"paramId":"keylight-softness","path":"/lighting/keyLight/softness","value":0.55,"confidence":0.95,"source":{"type":"expert-judgment","ref":"matrix-v1.0.1"},"calibration":{"method":"uncalibrated","status":"EXPERIMENTAL"}},{"paramId":"ambient-ratio","path":"/lighting/ambientRatio","value":0.18,"confidence":0.95,"source":{"type":"expert-judgment","ref":"matrix-v1.0.1"},"calibration":{"method":"uncalibrated","status":"EXPERIMENTAL"}},{"paramId":"rim-light-present","path":"/lighting/rimLightPresent","value":false,"confidence":0.95,"source":{"type":"expert-judgment","ref":"matrix-v1.0.1"},"calibration":{"method":"uncalibrated","status":"EXPERIMENTAL"}},{"paramId":"dominant-material-type","path":"/materials/0/baseType","value":"STONE::song-jade-stone","confidence":0.95,"source":{"type":"expert-judgment","ref":"matrix-v1.0.1"},"calibration":{"method":"uncalibrated","status":"EXPERIMENTAL"}},{"paramId":"dominant-material-roughness","path":"/materials/0/roughness","value":0.5,"confidence":0.95,"source":{"type":"expert-judgment","ref":"matrix-v1.0.1"},"calibration":{"method":"uncalibrated","status":"EXPERIMENTAL"}},{"paramId":"dominant-material-metalness","path":"/materials/0/metalness","value":0.08,"confidence":0.95,"source":{"type":"expert-judgment","ref":"matrix-v1.0.1"},"calibration":{"method":"uncalibrated","status":"EXPERIMENTAL"}},{"paramId":"dominant-material-wear","path":"/materials/0/wear","value":0.3,"confidence":0.95,"source":{"type":"expert-judgment","ref":"matrix-v1.0.1"},"calibration":{"method":"uncalibrated","status":"EXPERIMENTAL"}},{"paramId":"dominant-color","path":"/color/dominant","value":"#4A4C50","confidence":0.95,"source":{"type":"expert-judgment","ref":"matrix-v1.0.1"},"calibration":{"method":"uncalibrated","status":"EXPERIMENTAL"}},{"paramId":"secondary-color","path":"/color/secondary","value":"#B6A48B","confidence":0.95,"source":{"type":"expert-judgment","ref":"matrix-v1.0.1"},"calibration":{"method":"uncalibrated","status":"EXPERIMENTAL"}},{"paramId":"accent-color","path":"/color/accent","value":"#58738A","confidence":0.95,"source":{"type":"expert-judgment","ref":"matrix-v1.0.1"},"calibration":{"method":"uncalibrated","status":"EXPERIMENTAL"}},{"paramId":"contrast-ratio","path":"/color/contrastRatio","value":1.45,"confidence":0.95,"source":{"type":"expert-judgment","ref":"matrix-v1.0.1"},"calibration":{"method":"uncalibrated","status":"EXPERIMENTAL"}},{"paramId":"temperature-bias","path":"/color/temperatureBias","value":-0.08,"confidence":0.95,"source":{"type":"expert-judgment","ref":"matrix-v1.0.1"},"calibration":{"method":"uncalibrated","status":"EXPERIMENTAL"}}],"provenance":{"corpusSources":[{"corpusId":"golden-case-matrix-v1.0.1","title":"Golden Case Matrix Contract v1.0.1","type":"article"}],"distillationMethod":"synthetic representative-cell authoring"},"distillerVersion":"1.0.1","grammarVersion":"chinese-aesthetic@1.1.0","metadata":{"tags":["paradigm:SONG","material-category:STONE","lighting-intent:DIM","matrix-cell:MC-S01","synthetic-ir"]}}
